{
  "$schema": "http://json-schema.org/draft-07/schema#",
  "title": "Building Schema",
  "description": "Schema for building data structure",
  "definitions": {
    "BuildingId": {
      "type": "string",
      "enum": [
        "queen",
        "worker_ant_nest",
        "woodlouse_colony",
        "wet_soil_pile",
        "wet_soil_depot",
        "wet_soil_depot_2",
        "wet_soil_depot_3",
        "trophy_storeroom",
        "troop_tunnel",
        "treasure_depot",
        "toxic_fungi",
        "termite_farm",
        "supreme_native_fungi",
        "spring",
        "special_nest",
        "special_ant_habitat",
        "soldiers_reform_pool",
        "shooter_ant_nest",
        "sentinel_tree",
        "sand_pile",
        "sand_depot",
        "sand_depot_2",
        "sand_depot_3",
        "resource_tunnel",
        "resource_factory",
        "reservoir",
        "reservoir_2",
        "reservoir_3",
        "rally_center_i",
        "rally_center_ii",
        "rally_center_iii",
        "pro_rally_center",
        "plant_flora",
        "plant_depot",
        "plant_depot_2",
        "plant_depot_3",
        "native_fungi",
        "mutation_pool",
        "mutation_flora",
        "meat_depot",
        "meat_depot_2",
        "meat_depot_3",
        "leafcutter",
        "ladybug_habitat",
        "insect_nest",
        "insect_habitat",
        "healing_pool",
        "guardian_ant_nest",
        "fungus_depot",
        "fungus_depot_2",
        "fungus_depot_3",
        "feeding_ground",
        "evolution_fungi",
        "entrance",
        "construction_center",
        "cocoon_medium",
        "carrier_ant_nest",
        "aphid",
        "alliance_center"
      ]
    },
    "BuildingLevel": {
      "type": "object",
      "properties": {
        "depotCapacity": {
          "type": "number",
          "minimum": 0
        },
        "level": {
          "type": "number",
          "minimum": 1
        },
        "meat": {
          "type": "number",
          "minimum": 0
        },
        "fungus": {
          "type": "number",
          "minimum": 0
        },
        "plant": {
          "type": "number",
          "minimum": 0
        },
        "wet_soil": {
          "type": "number",
          "minimum": 0
        },
        "sand": {
          "type": "number",
          "minimum": 0
        },
        "diamonds": {
          "type": "number",
          "minimum": 0
        },
        "power": {
          "type": "number"
        },
        "power_delta": {
          "type": "number"
        },
        "population": {
          "type": "number",
          "minimum": 0
        },
        "honeydew": {
          "type": "number",
          "minimum": 0
        },
        "time": {
          "type": "number",
          "minimum": 0
        },
        "notes": {
          "type": "string"
        },
        "requirements": {
          "type": "object",
          "additionalProperties": {
            "type": "number",
            "minimum": 0
          },
          "patternProperties": {
            "^(queen|worker_ant_nest|woodlouse_colony|wet_soil_pile|wet_soil_depot|wet_soil_depot_2|wet_soil_depot_3|trophy_storeroom|troop_tunnel|treasure_depot|toxic_fungi|termite_farm|supreme_native_fungi|spring|special_nest|special_ant_habitat|soldiers_reform_pool|shooter_ant_nest|sentinel_tree|sand_pile|sand_depot|sand_depot_2|sand_depot_3|resource_tunnel|resource_factory|reservoir|reservoir_2|reservoir_3|rally_center_i|rally_center_ii|rally_center_iii|pro_rally_center|plant_flora|plant_depot|plant_depot_2|plant_depot_3|native_fungi|mutation_pool|mutation_flora|meat_depot|meat_depot_2|meat_depot_3|leafcutter|ladybug_habitat|insect_nest|insect_habitat|healing_pool|guardian_ant_nest|fungus_depot|fungus_depot_2|fungus_depot_3|feeding_ground|evolution_fungi|entrance|construction_center|cocoon_medium|carrier_ant_nest|aphid|alliance_center)$": {
              "type": "number",
              "minimum": 0
            }
          }
        }
      },
      "required": [
        "level",
        "meat",
        "fungus",
        "plant",
        "wet_soil",
        "sand",
        "diamonds",
        "power",
        "power_delta",
        "population",
        "honeydew",
        "time",
        "notes",
        "requirements"
      ],
      "additionalProperties": false
    },
    "Building": {
      "type": "object",
      "properties": {
        "id": {
          "$ref": "#/definitions/BuildingId"
        },
        "depotType": {
          "type": "string",
          "enum": ["meat", "fungus", "plant", "wet_soil", "sand", "water"]
        },
        "levels": {
          "type": "array",
          "items": {
            "$ref": "#/definitions/BuildingLevel"
          },
          "minItems": 1
        },
        "warns": {
          "type": "array",
          "items": {
            "type": "string"
          }
        }
      },
      "required": ["id", "levels", "warns"],
      "additionalProperties": false
    }
  },
  "type": "object",
  "$ref": "#/definitions/Building"
}
