{
  "$schema": "../building-schema.json",
  "id": "wet_soil_depot_3",
  "depotType": "wet_soil",
  "levels": [
    {
      "depotCapacity": 20000000,
      "level": 1,
      "meat": 0,
      "fungus": 0,
      "plant": 16000000,
      "wet_soil": 0,
      "sand": 3200000,
      "diamonds": 0,
      "power": 1480,
      "power_delta": 1480,
      "population": 0,
      "honeydew": 0,
      "time": 0,
      "notes": "",
      "requirements": {
        "queen": 20,
        "wet_soil_depot_2": 10
      }
    },
    {
      "depotCapacity": 40000000,
      "level": 2,
      "meat": 0,
      "fungus": 0,
      "plant": 26000000,
      "wet_soil": 0,
      "sand": 5200000,
      "diamonds": 8746,
      "power": 2038,
      "power_delta": 558,
      "population": 0,
      "honeydew": 6800000,
      "time": 5495.166666666667,
      "notes": "",
      "requirements": {
        "queen": 20,
        "wet_soil_depot_2": 10
      }
    },
    {
      "depotCapacity": 60000000,
      "level": 3,
      "meat": 0,
      "fungus": 0,
      "plant": 42000000,
      "wet_soil": 0,
      "sand": 8400000,
      "diamonds": 11075,
      "power": 2662,
      "power_delta": 624,
      "population": 0,
      "honeydew": 8800000,
      "time": 7143.833333333333,
      "notes": "",
      "requirements": {
        "queen": 20,
        "wet_soil_depot_2": 10
      }
    },
    {
      "depotCapacity": 80000000,
      "level": 4,
      "meat": 0,
      "fungus": 0,
      "plant": 64000000,
      "wet_soil": 0,
      "sand": 12000000,
      "diamonds": 14023,
      "power": 3460,
      "power_delta": 798,
      "population": 0,
      "honeydew": 10000000,
      "time": 9286.833333333334,
      "notes": "",
      "requirements": {
        "queen": 20,
        "wet_soil_depot_2": 10
      }
    },
    {
      "depotCapacity": 100000000,
      "level": 5,
      "meat": 0,
      "fungus": 0,
      "plant": 86000000,
      "wet_soil": 0,
      "sand": 16000000,
      "diamonds": 17758,
      "power": 4578,
      "power_delta": 1118,
      "population": 0,
      "honeydew": 12000000,
      "time": 12073,
      "notes": "",
      "requirements": {
        "queen": 20,
        "wet_soil_depot_2": 10
      }
    },
    {
      "depotCapacity": 120000000,
      "level": 6,
      "meat": 0,
      "fungus": 0,
      "plant": 100000000,
      "wet_soil": 0,
      "sand": 22000000,
      "diamonds": 24037,
      "power": 6387,
      "power_delta": 1809,
      "population": 0,
      "honeydew": 16000000,
      "time": 16902.166666666668,
      "notes": "",
      "requirements": {
        "queen": 20,
        "wet_soil_depot_2": 10
      }
    },
    {
      "depotCapacity": 140000000,
      "level": 7,
      "meat": 0,
      "fungus": 0,
      "plant": 201600000000,
      "wet_soil": 0,
      "sand": 26000000,
      "diamonds": 32536,
      "power": 8942,
      "power_delta": 2555,
      "population": 0,
      "honeydew": 18000000,
      "time": 23662.833333333332,
      "notes": "",
      "requirements": {
        "queen": 20,
        "wet_soil_depot_2": 10
      }
    },
    {
      "depotCapacity": 160000000,
      "level": 8,
      "meat": 0,
      "fungus": 0,
      "plant": 230400000000,
      "wet_soil": 0,
      "sand": 32000000,
      "diamonds": 44042,
      "power": 12514,
      "power_delta": 3572,
      "population": 0,
      "honeydew": 20000000,
      "time": 33128,
      "notes": "",
      "requirements": {
        "queen": 20,
        "wet_soil_depot_2": 10
      }
    },
    {
      "depotCapacity": 180000000,
      "level": 9,
      "meat": 0,
      "fungus": 0,
      "plant": 160000000,
      "wet_soil": 0,
      "sand": 34000000,
      "diamonds": 59615,
      "power": 17255,
      "power_delta": 4741,
      "population": 0,
      "honeydew": 24000000,
      "time": 46379.166666666664,
      "notes": "",
      "requirements": {
        "queen": 20,
        "wet_soil_depot_2": 10
      }
    },
    {
      "depotCapacity": 200000000,
      "level": 10,
      "meat": 0,
      "fungus": 0,
      "plant": 180000000,
      "wet_soil": 0,
      "sand": 36000000,
      "diamonds": 80696,
      "power": 24495,
      "power_delta": 7240,
      "population": 0,
      "honeydew": 26000000,
      "time": 64930.833333333336,
      "notes": "",
      "requirements": {
        "queen": 20,
        "wet_soil_depot_2": 10
      }
    }
  ],
  "warns": []
}