{
  "$schema": "../building-schema.json",
  "id": "wet_soil_depot_2",
  "depotType": "wet_soil",
  "levels": [
    {
      "depotCapacity": 2000000,
      "level": 1,
      "meat": 0,
      "fungus": 0,
      "plant": 420000,
      "wet_soil": 0,
      "sand": 84000,
      "diamonds": 0,
      "power": 161.0,
      "power_delta": 161.0,
      "population": 0,
      "honeydew": 0,
      "time": 0.0,
      "notes": "",
      "requirements": {
        "queen": 13,
        "wet_soil_depot": 10
      }
    },
    {
      "depotCapacity": 4000000,
      "level": 2,
      "meat": 0,
      "fungus": 0,
      "plant": 660000,
      "wet_soil": 0,
      "sand": 120000,
      "diamonds": 1123,
      "power": 210.0,
      "power_delta": 49.0,
      "population": 0,
      "honeydew": 320000,
      "time": 561.5,
      "notes": "",
      "requirements": {
        "queen": 13,
        "wet_soil_depot": 10
      }
    },
    {
      "depotCapacity": 6000000,
      "level": 3,
      "meat": 0,
      "fungus": 0,
      "plant": 1000000,
      "wet_soil": 0,
      "sand": 200000,
      "diamonds": 1422,
      "power": 276.0,
      "power_delta": 66.0,
      "population": 0,
      "honeydew": 440000,
      "time": 729.8333333333334,
      "notes": "",
      "requirements": {
        "queen": 13,
        "wet_soil_depot": 10
      }
    },
    {
      "depotCapacity": 8000000,
      "level": 4,
      "meat": 0,
      "fungus": 0,
      "plant": 1800000,
      "wet_soil": 0,
      "sand": 380000,
      "diamonds": 1925,
      "power": 389.0,
      "power_delta": 113.0,
      "population": 0,
      "honeydew": 600000,
      "time": 1021.8333333333334,
      "notes": "",
      "requirements": {
        "queen": 13,
        "wet_soil_depot": 10
      }
    },
    {
      "depotCapacity": 10000000,
      "level": 5,
      "meat": 0,
      "fungus": 0,
      "plant": 3400000,
      "wet_soil": 0,
      "sand": 660000,
      "diamonds": 2605,
      "power": 532.0,
      "power_delta": 143.0,
      "population": 0,
      "honeydew": 840000,
      "time": 1430.5,
      "notes": "",
      "requirements": {
        "queen": 13,
        "wet_soil_depot": 10
      }
    },
    {
      "depotCapacity": 15000000,
      "level": 6,
      "meat": 0,
      "fungus": 0,
      "plant": 5800000,
      "wet_soil": 0,
      "sand": 1200000,
      "diamonds": 3527,
      "power": 746.0,
      "power_delta": 214.0,
      "population": 0,
      "honeydew": 1400000,
      "time": 2002.6666666666667,
      "notes": "",
      "requirements": {
        "queen": 13,
        "wet_soil_depot": 10
      }
    },
    {
      "depotCapacity": 25000000,
      "level": 7,
      "meat": 0,
      "fungus": 0,
      "plant": 10000000,
      "wet_soil": 0,
      "sand": 2000000,
      "diamonds": 4773,
      "power": 1063.0,
      "power_delta": 317.0,
      "population": 0,
      "honeydew": 2400000,
      "time": 2803.6666666666665,
      "notes": "",
      "requirements": {
        "queen": 13,
        "wet_soil_depot": 10
      }
    },
    {
      "depotCapacity": 35000000,
      "level": 8,
      "meat": 0,
      "fungus": 0,
      "plant": 18000000,
      "wet_soil": 0,
      "sand": 3600000,
      "diamonds": 6461,
      "power": 1488.0,
      "power_delta": 425.0,
      "population": 0,
      "honeydew": 4200000,
      "time": 3925.1666666666665,
      "notes": "",
      "requirements": {
        "queen": 13,
        "wet_soil_depot": 10
      }
    },
    {
      "depotCapacity": 45000000,
      "level": 9,
      "meat": 0,
      "fungus": 0,
      "plant": 30000000,
      "wet_soil": 0,
      "sand": 6200000,
      "diamonds": 8746,
      "power": 2037.0,
      "power_delta": 549.0,
      "population": 0,
      "honeydew": 6800000,
      "time": 5495.166666666667,
      "notes": "",
      "requirements": {
        "queen": 13,
        "wet_soil_depot": 10
      }
    },
    {
      "depotCapacity": 55000000,
      "level": 10,
      "meat": 0,
      "fungus": 0,
      "plant": 50000000,
      "wet_soil": 0,
      "sand": 9600000,
      "diamonds": 11075,
      "power": 2693.0,
      "power_delta": 656.0,
      "population": 0,
      "honeydew": 8800000,
      "time": 7143.833333333333,
      "notes": "",
      "requirements": {
        "queen": 13,
        "wet_soil_depot": 10
      }
    }
  ],
  "warns": []
}
