{
  "$schema": "../building-schema.json",
  "id": "wet_soil_depot",
  "depotType": "wet_soil",
  "levels": [
    {
      "depotCapacity": 0,
      "level": 0,
      "meat": 0,
      "fungus": 0,
      "plant": 0,
      "wet_soil": 0,
      "sand": 0,
      "diamonds": 0,
      "power": 0.0,
      "power_delta": 0.0,
      "population": 0,
      "honeydew": 420,
      "time": 0.0,
      "notes": "",
      "requirements": {
        "queen": 1
      }
    },
    {
      "depotCapacity": 30000,
      "level": 1,
      "meat": 0,
      "fungus": 0,
      "plant": 0,
      "wet_soil": 280,
      "sand": 0,
      "diamonds": 0,
      "power": 52.0,
      "power_delta": 52.0,
      "population": 0,
      "honeydew": 0,
      "time": 0.0,
      "notes": "",
      "requirements": {}
    },
    {
      "depotCapacity": 50000,
      "level": 2,
      "meat": 0,
      "fungus": 0,
      "plant": 0,
      "wet_soil": 1400,
      "sand": 6400,
      "diamonds": 19,
      "power": 54.0,
      "power_delta": 2.0,
      "population": 0,
      "honeydew": 3200,
      "time": 6.0,
      "notes": "",
      "requirements": {
        "wet_soil_pile": 2
      }
    },
    {
      "depotCapacity": 100000,
      "level": 3,
      "meat": 0,
      "fungus": 0,
      "plant": 0,
      "wet_soil": 2200,
      "sand": 9400,
      "diamonds": 25,
      "power": 56.0,
      "power_delta": 2.0,
      "population": 0,
      "honeydew": 4600,
      "time": 7.833333333333333,
      "notes": "",
      "requirements": {
        "wet_soil_pile": 3
      }
    },
    {
      "depotCapacity": 200000,
      "level": 4,
      "meat": 0,
      "fungus": 0,
      "plant": 0,
      "wet_soil": 3200,
      "sand": 14000,
      "diamonds": 35,
      "power": 59.0,
      "power_delta": 3.0,
      "population": 0,
      "honeydew": 7000,
      "time": 11.833333333333334,
      "notes": "",
      "requirements": {
        "wet_soil_pile": 4
      }
    },
    {
      "depotCapacity": 300000,
      "level": 5,
      "meat": 0,
      "fungus": 0,
      "plant": 0,
      "wet_soil": 4800,
      "sand": 22000,
      "diamonds": 50,
      "power": 64.0,
      "power_delta": 5.0,
      "population": 0,
      "honeydew": 10000,
      "time": 17.666666666666668,
      "notes": "",
      "requirements": {
        "wet_soil_pile": 5
      }
    },
    {
      "depotCapacity": 400000,
      "level": 6,
      "meat": 0,
      "fungus": 0,
      "plant": 0,
      "wet_soil": 6800,
      "sand": 30000,
      "diamonds": 93,
      "power": 86.0,
      "power_delta": 22.0,
      "population": 0,
      "honeydew": 16000,
      "time": 35.166666666666664,
      "notes": "",
      "requirements": {
        "wet_soil_pile": 6
      }
    },
    {
      "depotCapacity": 500000,
      "level": 7,
      "meat": 0,
      "fungus": 0,
      "plant": 0.0,
      "wet_soil": 9400,
      "sand": 42000,
      "diamonds": 174,
      "power": 120.0,
      "power_delta": 34.0,
      "population": 0,
      "honeydew": 26000,
      "time": 70.33333333333333,
      "notes": "",
      "requirements": {
        "wet_soil_pile": 7
      }
    },
    {
      "depotCapacity": 700000,
      "level": 8,
      "meat": 0,
      "fungus": 0,
      "plant": 0.0,
      "wet_soil": 12000,
      "sand": 60000,
      "diamonds": 323,
      "power": 168.0,
      "power_delta": 48.0,
      "population": 0,
      "honeydew": 42000,
      "time": 140.5,
      "notes": "",
      "requirements": {
        "wet_soil_pile": 8
      }
    },
    {
      "depotCapacity": 1000000,
      "level": 9,
      "meat": 0,
      "fungus": 0,
      "plant": 0,
      "wet_soil": 18000,
      "sand": 82000,
      "diamonds": 437,
      "power": 243.0,
      "power_delta": 75.0,
      "population": 0,
      "honeydew": 80000,
      "time": 196.66666666666666,
      "notes": "",
      "requirements": {
        "wet_soil_pile": 9
      }
    },
    {
      "depotCapacity": 2000000,
      "level": 10,
      "meat": 0,
      "fungus": 0,
      "plant": 0,
      "wet_soil": 26000,
      "sand": 120000,
      "diamonds": 554,
      "power": 338.0,
      "power_delta": 95.0,
      "population": 0,
      "honeydew": 94000,
      "time": 255.66666666666666,
      "notes": "",
      "requirements": {
        "wet_soil_pile": 10
      }
    }
  ],
  "warns": []
}
